Wydatki Podatkowe,Milion Zlotys
tax_expenditure_Rate at which Small Corporations are Taxed,7
"tax_expenditure_Dochody(Przych.) Wolne Od Pod.,Cele Stat.",315
tax_expenditure_Dochody Wolne Od Podatku (Art.17 Ust.1 Pkt 4),2240
tax_expenditure_Dochody Z Działalności Pozarolniczej-Wolne Od Podatku,181
"tax_expenditure_Dotacje, Subwen., Dopłaty I Inne Nieodp. Swiad.-Wolne Od Podatku",1589
tax_expenditure_Dochód Wolny Od Podatku na Podstawie Art. 17 Ust.1 Pkt 23 I Pkt 24,7
tax_expenditure_Dochody Wolne Od Podatku Na Podstawie Art.17 Ust.1 Pkt.34,115
tax_expenditure_Dochody Wolne Od Podatku na Podstawie Art.17 Ust.1 Pkt.34,402
"tax_expenditure_Dochody Spółdzielni Mieszkan.,Wspólnot Mieszkan-Wolne od Podatku",957
tax_expenditure_Dotacje z Budżetu Państwa Lub Jst- Wolne od Podatku,2895
tax_expenditure_Kwoty od Agencji Rządowych Lub Agencji Wykonawczych-Wolne od Podat.,0
tax_expenditure_Dochody Grup Producentów Rolnych-Wolne od Podatku Na,20
tax_expenditure_Dochody z Tyt. Płatn. Progr.Finans.z Udz.środ.Europ.-od Podatku,9
"tax_expenditure_Dochody z Tyt. środ.Fin., Otrz. Przez Uczest.Proj.-Wolne od Podatku",638
tax_expenditure_Pozostałe Dochody (Przychody) Wolne od Podatku z Art.17 Ust.1 ,3932
tax_expenditure_Dochody Wolne od Podatku-Inne,225
